{
  "schema_version": 1,
  "capsule_id": "cap_00000000000000000000000000000001",
  "generated_at": "2026-10-01T09:00:06.000Z",
  "query": "合成项目下一步是什么？",
  "identity": [
    {
      "name": "core.md",
      "content": "Synthetic identity only"
    }
  ],
  "user_context": [],
  "relationship_context": [],
  "active_projects": [
    {
      "schema_version": 1,
      "memory_id": "mem_00000000000000000000000000000004",
      "type": "project_state",
      "content": "Synthetic project_state content",
      "source_id": "src_00000000000000000000000000000001",
      "created_at": "2026-10-01T09:00:00.000Z",
      "updated_at": "2026-10-01T09:00:00.000Z",
      "status": "active",
      "project_id": "prj_00000000000000000000000000000001",
      "tags": [
        "synthetic"
      ],
      "validity": null,
      "confidence": null,
      "supersedes": null,
      "state": "Model contracts in progress",
      "decisions": [
        "Keep Activity separate"
      ],
      "open_loops": [
        "Implement session turn linkage"
      ],
      "session_id": null,
      "covered_turns": null,
      "last_state": null
    }
  ],
  "relevant_memories": [],
  "recent_session_checkpoints": [
    {
      "schema_version": 1,
      "memory_id": "mem_00000000000000000000000000000005",
      "type": "session_checkpoint",
      "content": "Synthetic session_checkpoint content",
      "source_id": "src_00000000000000000000000000000003",
      "created_at": "2026-10-01T09:00:02.000Z",
      "updated_at": "2026-10-01T09:00:02.000Z",
      "status": "active",
      "project_id": null,
      "tags": [
        "synthetic"
      ],
      "validity": null,
      "confidence": null,
      "supersedes": null,
      "state": null,
      "decisions": [],
      "open_loops": [
        "Continue offline model validation"
      ],
      "session_id": "ses_00000000000000000000000000000001",
      "covered_turns": {
        "first_turn_id": "turn_00000000000000000000000000000001",
        "last_turn_id": "turn_00000000000000000000000000000002"
      },
      "last_state": "Synthetic checkpoint"
    }
  ],
  "recent_turns": [],
  "open_loops": [
    "Implement session turn linkage",
    "Continue offline model validation"
  ],
  "provenance": [
    {
      "entry_id": "identity:core.md",
      "source_id": null,
      "reason": "identity"
    },
    {
      "entry_id": "mem_00000000000000000000000000000004",
      "source_id": "src_00000000000000000000000000000001",
      "reason": "active_project"
    },
    {
      "entry_id": "mem_00000000000000000000000000000005",
      "source_id": "src_00000000000000000000000000000003",
      "reason": "recent_checkpoint"
    }
  ],
  "budget": {
    "max_tokens": 20000,
    "estimated_tokens": 2427,
    "reserve_tokens": 256,
    "policy": "utf8_bytes_v1"
  }
}
